id,sessionid,watersenid,content,sentiment_key,positive_probs
5091,0c2d9b959c04210eb6cbc51ca3834827,0,我去年腊月买的冰箱，上面那层不制冷，我想换,1,0.2015
5092,0c2d9b959c04210eb6cbc51ca3834827,1,打开京东我的客户服务申请售后的呢，可以申请售后的呢,1,0.2039
5093,0c2d9b959c04210eb6cbc51ca3834827,0,我想要申请售后服务，那样就可以那，多会给我换,1,0.4987
5094,0c2d9b959c04210eb6cbc51ca3834827,1,您申请后需要审核的哦，申请后专员会为您处理的呢,2,0.7695
5095,0c2d9b959c04210eb6cbc51ca3834827,0,那就是申请了会有人来看了冰箱对吧,1,0.5975
5096,0c2d9b959c04210eb6cbc51ca3834827,1,申请后专员会审核，一般是厂家需要上门检测的呢,1,0.1371
5097,0c2d9b959c04210eb6cbc51ca3834827,0,好吧，知道了，麻烦你了,2,0.5783
5098,0c2d9b959c04210eb6cbc51ca3834827,1,不客气的哈，耽误您的了,2,0.2591
5099,0c2d9b959c04210eb6cbc51ca3834827,0,没有了，我已经申请了售后，看那边情况再说吧,2,0.0369
5100,0c2d9b959c04210eb6cbc51ca3834827,1,好的呢，给您造成麻烦了呢，只要是这边的问题您是不用担心的哈，您保持手机畅通的哈，审核专员审核之后也是会联系您的呢，后期有问题再来咨询妹子哦,2,0.9887
5101,0c2e62d07d0cd7aa8a27818e4e6da0bd,0,售后发货的费用是用户出吗,1,0.015
5102,0c2e62d07d0cd7aa8a27818e4e6da0bd,1,您好，请您提供下订单号，帮您查看一下，好吗,1,0.5673
5103,0c2e62d07d0cd7aa8a27818e4e6da0bd,0,订单号,1,0.6557
5104,0c2e62d07d0cd7aa8a27818e4e6da0bd,1,还请您稍等，马上为您查询，QCYQYplus项圈式无线蓝牙耳机迷你头戴音乐耳机运动跑步小耳机智能蓝牙苹果小米通用黑色，什么费用的亲，配送找您收费的吗,1,0.619
5105,0c2e62d07d0cd7aa8a27818e4e6da0bd,0,我邮寄有问题的货品到你们提供的这是要自己出费用吗,1,0.0324
5106,0c2e62d07d0cd7aa8a27818e4e6da0bd,1,维修这个是您邮寄给我们的需要您支付的亲，维修有两种返回方式，第一，维修需要您发货使用第三方快递自行快递运费需要您承担单程的，维修好后是京东免费送货上门的第二，送货到京东自提，不需要承担快递费用自提是免费的哈，维修好后也是京东免费送货上门的流程会正常走处理流程的，请您放心,1,0.9943
5107,0c2e62d07d0cd7aa8a27818e4e6da0bd,0,哦明白,1,0.6515
5108,0c2e62d07d0cd7aa8a27818e4e6da0bd,1,麻烦您了呢,2,0.3787
5109,0c2f9adf8e242137d67844dcab05bd88,0,你好我售后自己记快递，想修改为京东取，可以么,1,0.614
5110,0c2f9adf8e242137d67844dcab05bd88,1,您好，还请您稍等，马上为您查询，请问是这个商品吗,1,0.0788
5111,0c2f9adf8e242137d67844dcab05bd88,0,是的,1,0.5473
5112,0c2f9adf8e242137d67844dcab05bd88,1,可以的，如果您修改，这边取件电话度吗，对吗,1,0.2746
5113,0c2f9adf8e242137d67844dcab05bd88,0,就是取件,1,0.6857
5114,0c2f9adf8e242137d67844dcab05bd88,1,号大呢，那就给您记录修改了哦,1,0.9325
5115,0c2f9adf8e242137d67844dcab05bd88,0,很小,1,0.3974
5116,0c2f9adf8e242137d67844dcab05bd88,1,辛苦了,1,0.792
5117,0c2f9adf8e242137d67844dcab05bd88,0,请问什么候能过来取呢,1,0.6647
5118,0c2f9adf8e242137d67844dcab05bd88,1,这边要看配送的的亲，由于年末了，这边配送爆仓的亲，所以取件也是会有延迟的呢，您看您是否方便的呢,1,0.7303
5119,0c2f9adf8e242137d67844dcab05bd88,0,我五半下班下班就不在这里了,1,0.1428
5120,0c2f9adf8e242137d67844dcab05bd88,1,已经反馈您的取件了，这边会审核的呢，今天，今天估计没法了，以及来不及了亲,1,0.6489
5121,0c2f9adf8e242137d67844dcab05bd88,0,明天早上九到十二在这边,1,0.7558
5122,0c2f9adf8e242137d67844dcab05bd88,1,好的，明白了，那就约明天也可以对吗，这边已经联系他们处理了,1,0.7322
5123,0c2fdc6f1d39e239e7c196c359512f19,0,不用发票,1,0.8288
5124,0c2fdc6f1d39e239e7c196c359512f19,1,好的，请您稍等，这边咨询不是一对一，同需要回复多个消息，我会尽快回复您，好的，订单完成之后这边告诉财务尽量不开发票可以吗,1,0.4318
5125,0c2fdc6f1d39e239e7c196c359512f19,0,就不开发票,1,0.1332
5126,0c2fdc6f1d39e239e7c196c359512f19,1,您可以取消重新拍的哦，选择开具电子发票,1,0.4969
5127,0c2fdc6f1d39e239e7c196c359512f19,0,包装后能拍个照看看嘛,1,0.3893
5128,0c2fdc6f1d39e239e7c196c359512f19,1,不能哦亲爱的，这个我们都查询不到的，您放心的哦，这个是购买的我们自营商品，都经过严格检测之后才会发给您的呢,2,0.7551
5129,0c2fdc6f1d39e239e7c196c359512f19,0,好的，谢谢,2,0.9693
5130,0c2fdc6f1d39e239e7c196c359512f19,1,您客气啦，亲爱的客户，有什么需要，可以联系我哦，我一直在电脑旁的，很乐意为您服务的哟，在的亲爱的,2,0.9228
5131,0c2fdc6f1d39e239e7c196c359512f19,0,我取消退货,1,0.0365
5132,0c2fdc6f1d39e239e7c196c359512f19,1,好的，请您稍等，这边咨询不是一对一，同需要回复多个消息，我会尽快回复您，您好，非常抱歉，订单一旦提交取消申请，无法撤销恢复，辛苦您关注下取消进度，如我们取消未拦截成功，会给您送货的，如取消拦截成功，订单将会取消，辛苦您重新订购哦，感谢您的理解，谢谢,1,0.7039
5133,0c3f65e44050eeb4d79174c2fa57b2d0,0,前订单当天到的呢,1,0.578
5134,0c3f65e44050eeb4d79174c2fa57b2d0,1,您好，请问有什么可以帮助您的么,1,0.413
5135,0c3f65e44050eeb4d79174c2fa57b2d0,0,那个京东不是有一个服务是说当天九之前下的订单当天到达的吗，是么，人呢,0,0.334
5136,0c3f65e44050eeb4d79174c2fa57b2d0,1,为了更好的解决您的问题，需要核实一下商品的信息奥，请问是这个商品吗,1,0.8546
5137,0c3f65e44050eeb4d79174c2fa57b2d0,0,那我可以自提么，能帮忙看看，自提在哪,1,0.5581
5138,0c3f65e44050eeb4d79174c2fa57b2d0,1,亲这个是下单的候选择的哦，您这个没有选择自提的呢,1,0.4628
5139,0c3f65e44050eeb4d79174c2fa57b2d0,0,哦哦，谢谢,2,0.9726
5140,0c3f65e44050eeb4d79174c2fa57b2d0,1,请问还有其他还可以帮到您的吗,2,0.4122
5141,0c4219543ab49146974c70f69ea5c99e,0,这个订单我想改下可以吗，你能看见我的订单不,1,0.1146
5142,0c4219543ab49146974c70f69ea5c99e,1,亲爱的，您的新和原是同一区域么如果不是同一区域的话建议您重新下单哦若是同一区域，请您提供新的详细哦，小妹帮您联系库房修改哦,2,0.9704
5143,0c4219543ab49146974c70f69ea5c99e,0,江苏,1,0.6384
5144,0c4219543ab49146974c70f69ea5c99e,1,亲爱的，妹子马上为您核实情况，请您稍等哈,2,0.5217
5145,0c4219543ab49146974c70f69ea5c99e,0,收件人电话不变，就改下，这样可以吗,1,0.1568
5146,0c4219543ab49146974c70f69ea5c99e,1,十分抱歉，这边同沟通+上帝，回复慢些，请理解等待分钟，这边会快马加鞭的努力回复的呢7,2,0.2386
5147,0c4219543ab49146974c70f69ea5c99e,0,嗯嗯,1,0.6703
5148,0c4219543ab49146974c70f69ea5c99e,1,是无法修改的呢，很抱歉,1,0.2033
5149,0c4219543ab49146974c70f69ea5c99e,0,没事，那算了,2,0.5238
5150,0c4219543ab49146974c70f69ea5c99e,1,建议您可以重新下单的呢，十分抱歉没有帮到您哈,1,0.4096
5151,0c4219543ab49146974c70f69ea5c99e,0,算了，就这样吧，没事没事，谢谢,2,0.5921
5152,0c4219543ab49146974c70f69ea5c99e,1,您客气了，为您服务是小妹的荣幸呢,2,0.8125
5153,0c48a9482170eaa475b4bc2b471d9e77,1,亲爱的您好，请问有什么问题我可以帮您处理或解决的呢,2,0.5222
5154,0c48a9482170eaa475b4bc2b471d9e77,0,有人在的吗，我想问问，第三方的要评价，是不是确定收货后，才可以评价的,1,0.1971
5155,0c48a9482170eaa475b4bc2b471d9e77,1,是的,1,0.5473
5156,0c48a9482170eaa475b4bc2b471d9e77,0,好的，明白了，谢谢,2,0.9436
5157,0c48a9482170eaa475b4bc2b471d9e77,1,您太客气了呢，这都是我应该做呢的,2,0.3656
5158,0c4d921faac7a4cdba197906c440d66d,0,请问为什么增票资质就是不通过呢，您这里是否有具体的原因呢，上次咨询说是名称错了可是哪里错了呢,0,0.5916
5159,0c4d921faac7a4cdba197906c440d66d,1,还请您稍等，马上为您查询,2,0.6492
5160,0c4d921faac7a4cdba197906c440d66d,0,好,1,0.958
5161,0c4d921faac7a4cdba197906c440d66d,1,查看驳回原因，您好，单位名称有误,1,0.7605
5162,0c4d921faac7a4cdba197906c440d66d,0,哪里错了呢问题是，别的也能开呀，为啥这里就不对,0,0.0721
5163,0c4d921faac7a4cdba197906c440d66d,1,我们财务会将您的税号输入到国税网查询信息的,1,0.4568
5164,0c4d921faac7a4cdba197906c440d66d,0,好的吧，所以您那里有具体正确的是吗，算了我再提交一次吧，麻烦了，辛苦，评价好了，多休息，再见,2,0.747
5165,0c4d921faac7a4cdba197906c440d66d,1,下单是,1,0.4016
5166,0c5987b050df1e4c4ce68a0536f65f18,0,现在申请好了吗，您好，订单编号的价格保护申请好了吗,1,0.3667
5167,0c5987b050df1e4c4ce68a0536f65f18,1,一般抱歉呢，亲爱的，在线客服都是对多服务，有候达到同回复位上帝，小手指实在是回应不过来了辛苦您耐心等等，谢谢您的理解7,2,0.3916
5168,0c5987b050df1e4c4ce68a0536f65f18,0,好的，您就看看帮我申请好元了吗,1,0.5203
5169,0c5987b050df1e4c4ce68a0536f65f18,1,帮您申请返回到您账户余额，一般天左右到账，到账后短信您,1,0.4577
5170,0c5987b050df1e4c4ce68a0536f65f18,0,可否返回原支付的信用卡,1,0.6263
5171,0c5987b050df1e4c4ce68a0536f65f18,1,退不了了,1,0.0379
5172,0c5987b050df1e4c4ce68a0536f65f18,0,好的那就余额，谢谢客服，五好评,2,0.983
5173,0c5987b050df1e4c4ce68a0536f65f18,1,您客气了,2,0.4719
5174,0c5987b050df1e4c4ce68a0536f65f18,0,没有了辛苦了,2,0.452
5175,0c5987b050df1e4c4ce68a0536f65f18,1,您客气了,2,0.4888
5176,0c61f54c94d98865ed6bd00109e7112f,1,亲爱的，妹子在的哦，您看这边有什么可以帮到您的吗,2,0.8371
5177,0c61f54c94d98865ed6bd00109e7112f,0,不小心收货了，实际还没收到,0,0.0446
5178,0c61f54c94d98865ed6bd00109e7112f,1,好的，请您稍等，这边咨询不是一对一，同需要回复多个消息，我会尽快回复您，配送员，电话，或，您看方便明天直接联系师傅核实下吗,1,0.2094
5179,0c61f54c94d98865ed6bd00109e7112f,0,好的,1,0.8609
5180,0c61f54c94d98865ed6bd00109e7112f,1,请问还有其他还可以帮到您的吗,2,0.4122
5182,0c668285fb2699548c38bd5cfc960de7,0,我上半年买的电脑配件坏了，我想返厂维修，可是我的发票掉了，这种情况如何返修啊,1,0.0109
5183,0c668285fb2699548c38bd5cfc960de7,1,亲爱的客户，麻烦您提供一下您的订单号，小妹这边帮您查询一下,2,0.7069
5184,0c668285fb2699548c38bd5cfc960de7,0,就是这个硬盘坏了,1,0.1174
5185,0c668285fb2699548c38bd5cfc960de7,1,是申请京东维修了吗,1,0.0704
5186,0c668285fb2699548c38bd5cfc960de7,0,是的,1,0.5473
5187,0c668285fb2699548c38bd5cfc960de7,1,京东维修不需要发票的,1,0.6784
5188,0c668285fb2699548c38bd5cfc960de7,0,我直接寄就可以了是吧,1,0.3572
5189,0c668285fb2699548c38bd5cfc960de7,1,对呀，辛苦您等待下哦,2,0.7609
5190,0c668285fb2699548c38bd5cfc960de7,0,没有了，还有就是您们的机器人客服真垃圾，我输入了几次人工客服都没有反应，气的很,0,0.024
5191,0c668285fb2699548c38bd5cfc960de7,1,确实抱歉,1,0.2424
5192,0c686fbf8c484e0cb7c0756423821727,1,请问还有其他还可以帮到您的吗,2,0.4122
5193,0c686fbf8c484e0cb7c0756423821727,0,我买了两个指甲钳只收到一个,0,0.4545
5194,0c686fbf8c484e0cb7c0756423821727,1,亲爱的，妹子马上为您核实情况，请您稍等哈，那一个订单是签收到了呢,2,0.4513
5195,0c686fbf8c484e0cb7c0756423821727,0,一个金色的一个白色的，白色的收到了,1,0.5371
5196,0c686fbf8c484e0cb7c0756423821727,1,是配送异常了，这边给您联系核实下，帮您配送到，配送员，电话，或，感谢您的耐心等待，也是他配送的,2,0.7743
5197,0c686fbf8c484e0cb7c0756423821727,0,那怎么办,0,0.2288
5198,0c686fbf8c484e0cb7c0756423821727,1,这边给您联系核实下，如方便您也可以联系下配送员核实的呢,1,0.3332
5199,0c686fbf8c484e0cb7c0756423821727,0,你给我核实,0,0.1647
5200,0c686fbf8c484e0cb7c0756423821727,1,好滴的，妹子已联系给您核实了哈,1,0.8495
5201,0c719849a9b7da25f2ee76c6d41c170e,0,人工服务，退款退到那，我之前用白天买的，白条，昨天我还完了，然后今天退款，请问钱退到那呢,1,0.0202
5202,0c719849a9b7da25f2ee76c6d41c170e,1,请您提供下订单号不要截图谢谢，这边帮您查询下，还请您耐心等待，亲爱的您是白条支付哦款项会在订单退款完成后个工作日内为您恢复额度如果您已经还款，会原返至您当还款银行卡上哦,2,0.5907
5203,0c719849a9b7da25f2ee76c6d41c170e,0,好的,2,0.8609
5204,0c719849a9b7da25f2ee76c6d41c170e,1,请问还有其他还可以帮到您的吗,2,0.4122
5206,0c74cbfa64412783cf2c4c1bddd5ea54,0,我号买的手机现在降价怎么办，我需要申请价格保护，人呢,0,0.6085
5207,0c74cbfa64412783cf2c4c1bddd5ea54,1,还请您稍等，马上为您查询,1,0.6492
5208,0c74cbfa64412783cf2c4c1bddd5ea54,0,订单号,1,0.6557
5209,0c74cbfa64412783cf2c4c1bddd5ea54,1,好的，为您申请元价保，价保申请成功后是到工作日到您的支付方式的,1,0.9346
5210,0c74cbfa64412783cf2c4c1bddd5ea54,0,到白条,1,0.4874
5211,0c74cbfa64412783cf2c4c1bddd5ea54,1,是的哈,1,0.759
5212,0c7a42f95e4d6e660d7bd22e0bd46248,0,买的网件R路由器，现在不能上网了，开机也开不了，复位也不能正常复位,1,0.0226
5213,0c7a42f95e4d6e660d7bd22e0bd46248,1,亲爱的客户，麻烦您击对话框右下角的+，击订单后，选择一下您需要咨询的订单哦，小妹这边帮您查询一下哦，亲亲之前使用是否正常的呢,2,0.748
5214,0c7a42f95e4d6e660d7bd22e0bd46248,0,之前使用是正常的,1,0.3532
5215,0c7a42f95e4d6e660d7bd22e0bd46248,1,亲亲订单号辛苦告知下妹子为您查询下,2,0.9298
5216,0c7a42f95e4d6e660d7bd22e0bd46248,0,这个,1,0.5268
5217,0c7a42f95e4d6e660d7bd22e0bd46248,1,美国网件NTGARRM双频千兆低辐射智能无线路由器，亲亲是这个是吗,1,0.2572
5218,0c7a42f95e4d6e660d7bd22e0bd46248,0,嗯嗯，是的,1,0.6373
5219,0c7a42f95e4d6e660d7bd22e0bd46248,1,如果是之前使用正常建议亲亲申请售后的哦,2,0.4422
5220,0c7a42f95e4d6e660d7bd22e0bd46248,0,好的售后吧，周期大概多久，毕竟没有用的了,1,0.3125
5221,0c7a42f95e4d6e660d7bd22e0bd46248,1,由于京东没有维修能力，商品一般都是返厂维修，周期是天左右因为每个商品的情况不一样，具体的需要根据商品的故障情况确定，给您是理论周期，一般不会这么久的,1,0.0598
5222,0c7a42f95e4d6e660d7bd22e0bd46248,0,好的,1,0.8609
5223,0c7a42f95e4d6e660d7bd22e0bd46248,1,那没为您申请了,1,0.6691
5224,0c7a42f95e4d6e660d7bd22e0bd46248,0,这个是取件么，上门,1,0.7828
5225,0c7a42f95e4d6e660d7bd22e0bd46248,1,亲亲是否需要妹子为您申请呢,2,0.8014
5226,0c7a42f95e4d6e660d7bd22e0bd46248,0,是上门取件的么,1,0.6353
5227,0c7a42f95e4d6e660d7bd22e0bd46248,1,对的亲亲,2,0.9568
5228,0c7a42f95e4d6e660d7bd22e0bd46248,0,好的，那你帮我预约一下吧，申请一下，我这边需要准备什么吗，除了商品以外,1,0.6099
5229,0c7a42f95e4d6e660d7bd22e0bd46248,1,黑龙江,1,0.7512
5230,0c7a42f95e4d6e660d7bd22e0bd46248,0,不是的,1,0.1166
5231,0c7a42f95e4d6e660d7bd22e0bd46248,1,取件核对下,1,0.6105
5232,0c7a42f95e4d6e660d7bd22e0bd46248,0,更改一下,1,0.2121
5233,0c7a42f95e4d6e660d7bd22e0bd46248,1,辛苦正确发送下哦,2,0.9823
5234,0c7a42f95e4d6e660d7bd22e0bd46248,0,黑龙江,1,0.7512
5235,0c7a42f95e4d6e660d7bd22e0bd46248,1,好的亲亲稍等，亲亲其他的需要修改吗,2,0.772
5236,0c7a42f95e4d6e660d7bd22e0bd46248,0,不需要，想问一下，我除了商品，还要准备什么吗，京东小哥是直接拿走我的路由器就完事了吗，我要不要包装的一下,1,0.1518
5237,0c7a42f95e4d6e660d7bd22e0bd46248,1,保持电话畅通等待专员审核配送取件即可,1,0.969
5238,0c7a42f95e4d6e660d7bd22e0bd46248,0,还是啥的啊,1,0.3469
5239,0c7a42f95e4d6e660d7bd22e0bd46248,1,找个可以保护您路由器的东西包装下就可以的,1,0.6616
5240,0c7a42f95e4d6e660d7bd22e0bd46248,0,好的，明白啦，谢谢，取件，选择在下午以后吧，可以吗,2,0.9267
5241,0c7a42f95e4d6e660d7bd22e0bd46248,1,亲亲取件可以和咱们配送师傅协商下的,2,0.7453
5242,0c7a42f95e4d6e660d7bd22e0bd46248,0,好的，可以,1,0.9376
5243,0c7a42f95e4d6e660d7bd22e0bd46248,1,请问还有其他还可以帮到您的吗,2,0.4122
5248,0c7b1eb0842c231a02d70022184f0c7d,0,减元的，请问刚刚我订单取消了，因为尺寸拍错了，那京东券可以再次使用吗,1,0.1511
5250,0c7b1eb0842c231a02d70022184f0c7d,0,辛苦了,1,0.8785
5251,0c7b1eb0842c231a02d70022184f0c7d,1,退款成功，可以原退,1,0.2424
5252,0c7b1eb0842c231a02d70022184f0c7d,0,今天能再次使用吗还是得等到钱退回来才能使用,1,0.0198
5253,0c7b1eb0842c231a02d70022184f0c7d,1,需要钱退回，才可以原退,1,0.2024
5254,0c7b1eb0842c231a02d70022184f0c7d,0,谢谢,2,0.9327
5255,0c7b1eb0842c231a02d70022184f0c7d,1,您客气了，为您服务是小妹的荣幸呢,2,0.6788
5256,0c7d870a7e4d7823d37e582c38b5e2ef,0,申请退货,1,0.0944
5257,0c7d870a7e4d7823d37e582c38b5e2ef,1,好的，请您稍等，这边咨询不是一对一，同需要回复多个消息，我会尽快回复您，您是拒收的吗,1,0.0989
5258,0c7d870a7e4d7823d37e582c38b5e2ef,0,商家让我确认收货，再申请退货，但是确认收货后，不能申请退货了，我之前申请过退款，由于商家放假，申请过期了,1,0.0031
5259,0c7d870a7e4d7823d37e582c38b5e2ef,1,建议您申请一下售后哦，在，返修退换申请，申请原因备注清楚拒收要求退款哦,1,0.0855
5260,0c7d870a7e4d7823d37e582c38b5e2ef,0,显示的该商品，已超过售后期,1,0.3759
5261,0c7d870a7e4d7823d37e582c38b5e2ef,1,这边给您申请可以吗,1,0.6248
5262,0c7d870a7e4d7823d37e582c38b5e2ef,0,可以,1,0.8501
5263,0c7d870a7e4d7823d37e582c38b5e2ef,1,收货人姓名，手机号，都不变吧,1,0.342
5264,0c7d870a7e4d7823d37e582c38b5e2ef,0,不变，申请退货,1,0.2136
5265,0c7d870a7e4d7823d37e582c38b5e2ef,1,已经申请，商家的审核一般是在小之内哦，审核过后将统一有短信告知审核结果，还麻烦您保持手机畅通,2,0.5574
5266,0c7d870a7e4d7823d37e582c38b5e2ef,0,好的,1,0.8609
5267,0c7d870a7e4d7823d37e582c38b5e2ef,1,请问还有其他还可以帮到您的吗,2,0.4122
5268,0c7d870a7e4d7823d37e582c38b5e2ef,0,没有了，谢谢,2,0.689
5269,0c7d870a7e4d7823d37e582c38b5e2ef,1,您客气啦，亲爱的客户，有什么需要，可以联系我哦，我一直在电脑旁的，很乐意为您服务的哟,2,0.972
5270,0c9dcb7f70505e58383337b44701f3ed,0,小姐姐，你还在吗，我已经买了,1,0.5448
5273,0c9dcb7f70505e58383337b44701f3ed,1,为了更快的处理您的问题，辛苦您提供下订单号给我可以吗,1,0.6547
5274,0c9dcb7f70505e58383337b44701f3ed,0,但他们还没有说话，不能复制，好尴尬,0,0.061
5275,0c9dcb7f70505e58383337b44701f3ed,1,您击我的订单订单详情，查询一下订单编号,1,0.7335
5276,0c9dcb7f70505e58383337b44701f3ed,0,就是催下他们，一起买的另一家已经出库了,1,0.1455
5277,0c9dcb7f70505e58383337b44701f3ed,1,您不用着急哦，您的订单由咱们厂家直接提供配送服务哒，正常配送效为个工作日左右，还希望您耐心等待哟,2,0.9272
5278,0c9dcb7f70505e58383337b44701f3ed,0,那这个可以退货不，小姐姐，不在了吗,1,0.0311
5279,0c9dcb7f70505e58383337b44701f3ed,1,好的，请您稍等，这边咨询不是一对一，同需要回复多个消息，我会尽快回复您，您好，您可以在我的订单详情页面申请退款或取消订单哦，取消后系统会进行全力拦截，拦截失败的话还请您拒收下就可以呢,1,0.0547
5280,0c9dcb7f70505e58383337b44701f3ed,0,我现在不退，是说收到之后不满意可以退不，就怕他们是假的,0,0.0311
5281,0c9dcb7f70505e58383337b44701f3ed,1,您好，京东销售的商品均为正品真品哦，我们的商品均由正规的渠道进货，质量是有保证的，请您放心购买，如您购买的商品后期出现质量问题，我们也有完善的售后政策为您处理的，签收之后天内商品不影响二次销售前提下可以申请退的哦,1,0.1654
5282,0c9dcb7f70505e58383337b44701f3ed,0,嗯嗯,1,0.6703
5283,0c9dcb7f70505e58383337b44701f3ed,1,请问还有其他还可以帮到您的吗，对不起，妹子怠慢了，妹子这边咨询的客户有多，回复较慢，请您见谅下哦,2,0.2508
5284,0c9dcb7f70505e58383337b44701f3ed,0,谢谢啦，再见，小姐姐,2,0.8875
5285,0c9dcb7f70505e58383337b44701f3ed,1,您客气啦，亲爱的客户，有什么需要，可以联系我哦，我一直在电脑旁的，很乐意为您服务的哟,2,0.972
5286,0ca4c4a5dc05da5ca0729f4f3a3ec58c,0,这单明天能到货吗,1,0.1646
5287,0ca4c4a5dc05da5ca0729f4f3a3ec58c,1,马上核实情况，请您稍等哈,1,0.2994
5288,0ca4c4a5dc05da5ca0729f4f3a3ec58c,0,好的,1,0.8609
5289,0ca4c4a5dc05da5ca0729f4f3a3ec58c,1,亲爱的这个是自营的呢，但是是我们和厂家合作发货的哦，您的订单是厂商自己配送，预计会在个工作日内送达您的手中，还辛苦您保持手机畅通等待配送员送货哦,2,0.9667
5290,0ca4c4a5dc05da5ca0729f4f3a3ec58c,0,现在可以帮我取消这件商品吗我想选个明天能到货的,1,0.4553
5291,0ca4c4a5dc05da5ca0729f4f3a3ec58c,1,是可以的哦,2,0.8869
5292,0ca4c4a5dc05da5ca0729f4f3a3ec58c,0,帮我取消一下,1,0.4581
5293,0ca4c4a5dc05da5ca0729f4f3a3ec58c,1,那好的，预计帮您取消,1,0.6398
5294,0ca4c4a5dc05da5ca0729f4f3a3ec58c,0,预计，帮我取消就好了,2,0.4843
5295,0ca4c4a5dc05da5ca0729f4f3a3ec58c,1,亲爱的，厂家取消订单，预计工作日审核退款哦,2,0.1692
5296,0ca4c4a5dc05da5ca0729f4f3a3ec58c,0,好的,1,0.8609
5297,0ca4c4a5dc05da5ca0729f4f3a3ec58c,1,妹子这边会帮您跟进到您退款完成，还请您放心哈，还请您放心哈,2,0.877
5298,0ca4c4a5dc05da5ca0729f4f3a3ec58c,0,没有了，谢谢,2,0.689
5299,0ca4c4a5dc05da5ca0729f4f3a3ec58c,1,您客气啦，亲爱的，有什么需要，可以联系我哦，我一直在电脑旁的，很乐意为您服务的哟，亲爱哒，来都来了，用你发财的小手给我一个评价吧，谢谢,2,0.9806
5300,0ca63cdd96e81c3e2ec85a5526e845ee,0,自提几天，麻烦问一下，自提几天内,1,0.549
5301,0ca63cdd96e81c3e2ec85a5526e845ee,1,天内,1,0.468
5302,0ca63cdd96e81c3e2ec85a5526e845ee,0,好的谢谢过年自提都上班吧,2,0.9445
5303,0ca63cdd96e81c3e2ec85a5526e845ee,1,恩是的,1,0.6404
5304,0ca63cdd96e81c3e2ec85a5526e845ee,0,好，谢谢,2,0.9758
5305,0ca63cdd96e81c3e2ec85a5526e845ee,1,不客气,2,0.1993
5307,0cac49184a0d777a3d87f70bd9154d55,0,提醒他们下，我要上门去取,1,0.8742
5308,0cac49184a0d777a3d87f70bd9154d55,1,我备注下，说今天已经在安排了您现在出发了吗,1,0.2601
5309,0cac49184a0d777a3d87f70bd9154d55,0,还没，什么候送过来,1,0.474
5310,0cac49184a0d777a3d87f70bd9154d55,1,这个区域的今天配送带出去了那应该就能送掉，您在等待下哈，这个是回复的,1,0.4964
5311,0cac49184a0d777a3d87f70bd9154d55,0,好的,1,0.8609
5312,0cac49184a0d777a3d87f70bd9154d55,1,嗯嗯,1,0.6703
5313,0cac49184a0d777a3d87f70bd9154d55,0,今天应该能到吧帮忙要下运送人电话,1,0.5548
5314,0cac49184a0d777a3d87f70bd9154d55,1,我问问,1,0.3869
5315,0cac49184a0d777a3d87f70bd9154d55,0,好，谢谢,2,0.9758
5316,0cac49184a0d777a3d87f70bd9154d55,1,您客气啦，亲爱的客户，有什么需要，可以联系我哦，我一直在电脑旁的，很乐意为您服务的哟,2,0.9086
5317,0cac49184a0d777a3d87f70bd9154d55,0,谢谢了，没有了,2,0.758
5318,0cb2b2a8e4b25770b3d89a1580c78665,0,我想询问关于发票的，我买了东西想下载发票的候发现抬头是个人这个能改吗,1,0.0952
5319,0cb2b2a8e4b25770b3d89a1580c78665,1,为了更好的解决您的问题，需要核实一下商品的信息奥，请问是这个商品吗，这个是可以修改的呢,1,0.3021
5320,0cb2b2a8e4b25770b3d89a1580c78665,0,要怎么改,1,0.0994
5321,0cb2b2a8e4b25770b3d89a1580c78665,1,但是现在我们财务那边放假了需要您年后l联系一下我们给您修改的哦,1,0.9353
5322,0cb2b2a8e4b25770b3d89a1580c78665,0,好的，这个开票最晚多久，我买了东西之后多久开票是有效的这个有讲究吗,1,0.648
5323,0cb2b2a8e4b25770b3d89a1580c78665,1,天内联系我们处理哦,2,0.8918
5324,0cb2b2a8e4b25770b3d89a1580c78665,0,那你们财务节后几号上班啊,1,0.3139
5325,0cb2b2a8e4b25770b3d89a1580c78665,1,预计是号之后上班的呢,1,0.7425
5326,0cb2b2a8e4b25770b3d89a1580c78665,0,好的，谢谢,2,0.9693
5327,0cb2b2a8e4b25770b3d89a1580c78665,1,您到候联系我们提供一下抬头和税号就是会给您反馈财务处理的哦,2,0.7665
5328,0cb330ac7f84aca8e542905cf18e3168,0,我的快递到哪了，没打电话,0,0.3454
5329,0cb330ac7f84aca8e542905cf18e3168,1,好的，请您稍等，这边咨询不是一对一，同需要回复多个消息，我会尽快回复您，手机号码,1,0.626
5330,0cb330ac7f84aca8e542905cf18e3168,0,没有，手机都没显示，帮我查个,0,0.0577
