id,sessionid,watersenid,content,sentiment_key,positive_probs
2535,05dd828cfe120ab556bb2d6bfa724677,1,请问还有其他还可以帮到您的吗,2,0.405
2536,05dd828cfe120ab556bb2d6bfa724677,0,没了,1,0.9856
2537,05dd828cfe120ab556bb2d6bfa724677,1,新年快乐，妹子祝福您幸福快乐，前程锦绣，还请您击表情栏旁边的+打赏我一个评价哦,2,0.9926
2539,05e07ea1399b7185727dec6b049e5647,0,我要退回的订单已经送到自提了，为什么还没更新，我要退回的产品已经送到自提了，我要咨询其他问题，自提查询,0,0.2689
2540,05e07ea1399b7185727dec6b049e5647,1,马上核实情况，请您稍等哈，您送到的哪个自提呢,1,0.4781
2541,05e07ea1399b7185727dec6b049e5647,0,效率很慢啊，自提，下午四前就送到了，多久可以核实,0,0.0568
2542,05e07ea1399b7185727dec6b049e5647,1,马上核实情况，请您稍等哈，德州，这个吗,2,0.1027
2543,05e07ea1399b7185727dec6b049e5647,0,是的，德州就一个自提吧,1,0.4188
2544,05e07ea1399b7185727dec6b049e5647,1,今天送的吗,1,0.296
2545,05e07ea1399b7185727dec6b049e5647,0,是，下午送到的,1,0.8163
2546,05e07ea1399b7185727dec6b049e5647,1,这个会操作返回的,1,0.7032
2547,05e07ea1399b7185727dec6b049e5647,0,现在还没显示京东收货呢,0,0.1269
2548,05e07ea1399b7185727dec6b049e5647,1,是的哦,2,0.8208
2549,05e07ea1399b7185727dec6b049e5647,0,我的东西送到了，还显示等待送货,0,0.5788
2550,05e07ea1399b7185727dec6b049e5647,1,到达售后之后会显示收货,1,0.0989
2551,05e07ea1399b7185727dec6b049e5647,0,售后是哪里，不是到了自提然后就显示吗,0,0.0125
2552,05e07ea1399b7185727dec6b049e5647,1,您送到自提，然后自提的配送员再把商品送回售后,1,0.0246
2553,05e07ea1399b7185727dec6b049e5647,0,售后是哪里，大约多久可以更新,0,0.0948
2554,05e07ea1399b7185727dec6b049e5647,1,预计今天或者明天呢,1,0.6399
2555,05e07ea1399b7185727dec6b049e5647,0,有德州自提电话吗,1,0.3558
2556,05e07ea1399b7185727dec6b049e5647,1,的私人电话无法提供呢,1,0.2417
2557,05e07ea1399b7185727dec6b049e5647,0,我现在东西送到了，他不给我更新,0,0.5172
2558,05e07ea1399b7185727dec6b049e5647,1,预计今天或者明天更新,1,0.5119
2559,05e07ea1399b7185727dec6b049e5647,0,确定吗,1,0.0394
2560,05e07ea1399b7185727dec6b049e5647,1,是的票,1,0.4645
2561,05e07ea1399b7185727dec6b049e5647,0,没有，快更新就行了,0,0.1225
2562,05e07ea1399b7185727dec6b049e5647,1,好的哦,2,0.941
2563,05e6d1647578a28209a849e8e40ea348,0,人工客服,1,0.1856
2564,05e6d1647578a28209a849e8e40ea348,1,您好，还请您稍等，马上为您查询，请问是这个商品吗,1,0.0763
2565,05e6d1647578a28209a849e8e40ea348,0,是的，今天会送货吗，今天还送货吗,1,0.1256
2566,05e6d1647578a28209a849e8e40ea348,1,已经到了，这边会尽快安排的亲，接到通知，爆仓导致物流延迟的亲，请您谅解下的呢，这边已经在进行清场了呢，会尽快安排进行配送的哦,1,0.673
2567,05e6d1647578a28209a849e8e40ea348,0,可以自己去提货吗,1,0.5755
2568,05e6d1647578a28209a849e8e40ea348,1,到了，如果您方便，可以的，您看嗯,2,0.7274
2569,05e6d1647578a28209a849e8e40ea348,0,具体位置在哪,1,0.5534
2570,05e6d1647578a28209a849e8e40ea348,1,我给您找下，上海，都可以过去提货了，辛苦了,1,0.7619
2571,05e6d1647578a28209a849e8e40ea348,0,爆仓今天不一定会送是吧,1,0.1629
2572,05e6d1647578a28209a849e8e40ea348,1,不一定的亲，抱歉呢,2,0.342
2573,05e6d1647578a28209a849e8e40ea348,0,好的，知道了，谢谢,2,0.9622
2574,05e6d1647578a28209a849e8e40ea348,1,不客气的，您的满意是我们的追求期待能再次为您服务，缘聚缘散缘如水，背负万丈尘寰，只为一句，等待下一次相逢，还请您空闲击满意度评价为我加油，也好让我们能再续良缘哦谢谢您哦,2,0.9902
2575,05e76394ef304b075e28cb17e52f320b,0,可否过天再发货，可否过天再发货,1,0.0967
2576,05e76394ef304b075e28cb17e52f320b,1,不行的亲爱的,2,0.1716
2577,05e76394ef304b075e28cb17e52f320b,0,家里没人签收,1,0.282
2578,05e76394ef304b075e28cb17e52f320b,1,亲爱的您看当是否有代收呢,2,0.8677
2579,05e76394ef304b075e28cb17e52f320b,0,那到候我叫快递员晚十天送吧,1,0.478
2580,05e76394ef304b075e28cb17e52f320b,1,可以协商先操作订单完成后放在的,1,0.731
2581,05e76394ef304b075e28cb17e52f320b,0,好的,1,0.8565
2582,05e76394ef304b075e28cb17e52f320b,1,还辛苦您给小妹打个评价呢击表情栏旁边的+哦,2,0.6643
2583,05e913d89721d3d0d81bfe1b6630b2ad,0,我想问问京东自提柜是哪年开始的,1,0.4128
2585,05e913d89721d3d0d81bfe1b6630b2ad,0,我想问问京东自提柜是哪年开始的，就这一个问题,1,0.1819
2586,05e913d89721d3d0d81bfe1b6630b2ad,1,稍等一下，我得去查一下,1,0.117
2587,05e913d89721d3d0d81bfe1b6630b2ad,0,好的，好的，谢谢,2,0.9774
2588,05e913d89721d3d0d81bfe1b6630b2ad,1,遇到像您这样宽容的客户真是对我莫大的支持呢还辛苦您击+给小妹评价下祝您天天开心哦,2,0.9791
2590,05f3b862fdf988f1006edb893e0eed20,0,售后另约，我要另约，要怎么操作,1,0.068
2591,05f3b862fdf988f1006edb893e0eed20,1,修改取件吗，什么呢,1,0.284
2592,05f3b862fdf988f1006edb893e0eed20,0,今天或明天,1,0.6268
2593,05f3b862fdf988f1006edb893e0eed20,1,明天早上可以吗，已经修改，这个只能大概效的,1,0.3682
2594,05f3b862fdf988f1006edb893e0eed20,0,好的,1,0.8565
2595,05f3b862fdf988f1006edb893e0eed20,1,辛苦您等待下哦,2,0.7118
2596,05f3b862fdf988f1006edb893e0eed20,0,你们取完货什么候能拿到新的,1,0.5352
2597,05f3b862fdf988f1006edb893e0eed20,1,咱们售后接收到商品，确定有质量问题日之内会给您完成换货的哦到您的京东账户内会有换新订单哒，还麻烦您查看呢,2,0.4934
2598,05f3b862fdf988f1006edb893e0eed20,0,但是号之后我没空，你们你能尽快处理吗,1,0.0363
2599,05f3b862fdf988f1006edb893e0eed20,1,这边收货之后很快处理的,1,0.684
2600,05f3b862fdf988f1006edb893e0eed20,0,好的，谢谢,2,0.9683
2601,05f3b862fdf988f1006edb893e0eed20,1,辛苦您等待下哦,2,0.7118
2602,05f3d186dab342a5c79e3e29e2a1f30b,0,能改吗,1,0.0981
2603,05f3d186dab342a5c79e3e29e2a1f30b,1,马上核实情况，请您稍等哈，您查看我的订单订单详情修改按钮能不能使用无法使用取消订单重新下单呢,1,0.0083
2604,05f3d186dab342a5c79e3e29e2a1f30b,0,广东，不能,0,0.0882
2605,05f3d186dab342a5c79e3e29e2a1f30b,1,那就退款重新购买呢,1,0.111
2606,05f3d186dab342a5c79e3e29e2a1f30b,0,你不能改吗,0,0.0293
2607,05f3d186dab342a5c79e3e29e2a1f30b,1,我这边无法修改订单信息呢,1,0.2773
2608,05f3d186dab342a5c79e3e29e2a1f30b,0,好吧,1,0.6623
2609,05f3d186dab342a5c79e3e29e2a1f30b,1,请问还有其他还可以帮到您的吗,2,0.405
2610,05f3d186dab342a5c79e3e29e2a1f30b,0,没有了,1,0.6488
2611,05fba2f4f60f476943a47d9e823b6a18,0,我昨天晚上下了那个订单和哪去啦,0,0.3771
2612,05fba2f4f60f476943a47d9e823b6a18,1,小妹为您看看，您稍等哦，您的订单正在配送途中，请您准备签收配送员，均，电话，感谢您的耐心等待，目前显示送货中，请您耐心等待下哦,2,0.9445
2613,05fba2f4f60f476943a47d9e823b6a18,0,快递员说没货，你给我查查,0,0.0285
2614,05fba2f4f60f476943a47d9e823b6a18,1,请您稍等，正在联系,1,0.547
2615,05fba2f4f60f476943a47d9e823b6a18,0,怎么样啦找到没有,0,0.6576
2616,05fba2f4f60f476943a47d9e823b6a18,1,暂还未回复,1,0.0533
2617,05fba2f4f60f476943a47d9e823b6a18,0,你们快递员货送过来啦，他自己送错方了好吧，谢谢你啊,2,0.8612
2618,05fba2f4f60f476943a47d9e823b6a18,1,哦哦好的，您客气了哦，收到就好了，麻烦给小妹一个评价啦您的支持是我最大的动力呢,2,0.9571
2619,05fba2f4f60f476943a47d9e823b6a18,0,挺好的,1,0.9409
2620,05fba2f4f60f476943a47d9e823b6a18,1,谢谢您哦,2,0.9534
2621,05fdc9d48e5ea45a487d53c9a6cd512a,0,我用e卡买的东西，可以退吗，就想从新凑单,1,0.2778
2622,05fdc9d48e5ea45a487d53c9a6cd512a,1,可以的亲，礼品卡支付的金额也是正常返回的呀,1,0.6614
2623,05fdc9d48e5ea45a487d53c9a6cd512a,0,那我要求退货，e卡也是直接返回，好的,1,0.4745
2624,05fdc9d48e5ea45a487d53c9a6cd512a,1,是的亲,1,0.4198
2625,05fdc9d48e5ea45a487d53c9a6cd512a,0,没有了，谢谢,2,0.685
2626,05fdc9d48e5ea45a487d53c9a6cd512a,1,退款效个工作日哈,1,0.2519
2627,06143ad9d70bafb1e5571a790a0fec95,1,您好，请问有什么可以帮您,2,0.5625
2628,06143ad9d70bafb1e5571a790a0fec95,0,刚才没有接到电话，想确认一下收货,1,0.1621
2629,06143ad9d70bafb1e5571a790a0fec95,1,这边帮您联系库房哈,2,0.9032
2630,06143ad9d70bafb1e5571a790a0fec95,0,好的,1,0.8565
2631,06143ad9d70bafb1e5571a790a0fec95,1,联系之后库房应该会再次联系您,1,0.4673
2632,06293b860e7b44632bb72ae4c7a92b78,0,那我退货中的发货和收货都是自己的吗,1,0.0312
2633,06293b860e7b44632bb72ae4c7a92b78,1,是的,1,0.4466
2634,06293b860e7b44632bb72ae4c7a92b78,0,上门取件是直接把物品交给快递就行了吗，还要填单子吗,1,0.0197
2635,06293b860e7b44632bb72ae4c7a92b78,1,不需要货直接给快递就行,1,0.4215
2636,06293b860e7b44632bb72ae4c7a92b78,0,好，想象，谢谢,2,0.9765
2637,06293b860e7b44632bb72ae4c7a92b78,1,不客气的,2,0.2138
2638,063948664212c4f18fb283c6fbfaf1dc,0,几个月不给我退款是什么意思，为什么几个月一直不给我退款呢，,0,0.0073
2639,063948664212c4f18fb283c6fbfaf1dc,1,我来申请退款可以吗,1,0.0679
2640,063948664212c4f18fb283c6fbfaf1dc,0,双十二挂到现在，我也是醉了，我这边申请不了店铺客服也不理人,0,0.3953
2641,063948664212c4f18fb283c6fbfaf1dc,1,好了，等待退款就行了,1,0.2577
2642,063948664212c4f18fb283c6fbfaf1dc,0,好的，谢谢,2,0.9683
2643,063948664212c4f18fb283c6fbfaf1dc,1,您客气啦，亲爱的客户，有什么需要，可以联系我哦，我一直在电脑旁的，很乐意为您服务的哟,2,0.9055
2644,0643d3938b05ce35434a2652f4115faa,0,你好我手机买了不到个月，然后充电器的头坏了，数据线没问题,0,0.2953
2645,0643d3938b05ce35434a2652f4115faa,1,您申请售后之后不要着急，正常情况下内审核之后会有售后同事联系您，包括但不限于电话和短信联系，申请路径，可通过我的京东客户服务返修退换货内申请也可直接击此链接，APP端可通过我的客户服务退换售后中申请;可通过个人中心客户服务退换售后进行申请哦京东自营的返修退换货当天之前提交的返修单，在当天之前会有人员审核，之后提交的返修单次日之前会有人员审核,1,0.2769
2646,0643d3938b05ce35434a2652f4115faa,0,都刷不出来怎么提交,0,0.1548
2647,0643d3938b05ce35434a2652f4115faa,1,那建议您换个网络，或者设备,1,0.3527
2648,0643d3938b05ce35434a2652f4115faa,0,已经跳转到售后服务页面，不知道是我网络事，还是你京东的事，打开别的都可以，售后维修不行,0,0.0027
2649,0643d3938b05ce35434a2652f4115faa,1,我帮您提交,1,0.701
2650,0643d3938b05ce35434a2652f4115faa,0,还要留吗,1,0.1025
2651,0643d3938b05ce35434a2652f4115faa,1,您申请售后之后不要着急，正常情况下内审核之后会有售后同事联系您，包括但不限于电话和短信联系，我这里有,1,0.1902
2652,0643d3938b05ce35434a2652f4115faa,0,壹号院的那个就好了,1,0.3588
2653,0643d3938b05ce35434a2652f4115faa,1,好的，您等待一下联系吧,1,0.7637
2654,0643d3938b05ce35434a2652f4115faa,0,提交了大概今天就能联系我了呗，已经跳转到售后服务页面,1,0.1678
2655,0643d3938b05ce35434a2652f4115faa,1,六之前,1,0.5535
2656,0643d3938b05ce35434a2652f4115faa,0,你帮我提交了吗,1,0.2871
2657,0643d3938b05ce35434a2652f4115faa,1,遇到像您这样宽容的客户真是对我莫大的支持呢还辛苦您击+给小妹评价下天凉了哦要多多注意保暖哦,2,0.9812
2658,0643d3938b05ce35434a2652f4115faa,0,没得了，谢谢,2,0.9394
2659,0644e7307d30eb27f5ca2109f2847cd3,0,麻烦帮我催下，尽快发货,1,0.1565
2661,0644e7307d30eb27f5ca2109f2847cd3,0,麻烦让尽快发货，我下午要走了，尽快送达商品到我的,1,0.3019
2662,0644e7307d30eb27f5ca2109f2847cd3,1,是爆仓了可能是会有延迟的呢，我们已经是在加班加处理的哦,2,0.4852
2663,0644e7307d30eb27f5ca2109f2847cd3,0,好的，那就不打扰了,2,0.7548
2664,0644e7307d30eb27f5ca2109f2847cd3,1,请问还有其他还可以帮到您的吗,2,0.405
2665,0644e7307d30eb27f5ca2109f2847cd3,0,没了新年快乐,2,0.9791
2666,06469544db28f69286a8bbf0f169d886,0,好，这件衣服是上个月月底收到的，前天才穿，结果发现右胳肢窝漏缝，未缝合怎么办啊,0,0.0178
2667,06469544db28f69286a8bbf0f169d886,1,可以申请售后换货的哦,2,0.927
2668,06469544db28f69286a8bbf0f169d886,0,售后不受理，我想要申请售后服务,1,0.0273
2669,06469544db28f69286a8bbf0f169d886,1,小妹建议您可以申请售后哦在您的手机端右下角我的返修退换申请,1,0.372
2670,06469544db28f69286a8bbf0f169d886,0,我想要申请售后服务,1,0.3028
2671,06469544db28f69286a8bbf0f169d886,1,在您的手机端右下角我的返修退换申请哈,1,0.2879
2672,06469544db28f69286a8bbf0f169d886,0,不需要了,0,0.7361
2674,0646cdb9675d8f7797b705b7afde84ab,1,您方便简单描述下您的问题吗,1,0.2572
2675,0646cdb9675d8f7797b705b7afde84ab,0,亲，这个衣服我刚已经成功申请退货京东上门取件，京东上门取件刚才发现需要修改,1,0.7467
2676,0646cdb9675d8f7797b705b7afde84ab,1,小妹为您看看，您稍等哦,1,0.6254
2677,0646cdb9675d8f7797b705b7afde84ab,0,好的,1,0.8565
2678,0646cdb9675d8f7797b705b7afde84ab,1,这个需要联系卖家呢,1,0.4323
2679,0646cdb9675d8f7797b705b7afde84ab,0,哦，好的,1,0.9296
2680,0646cdb9675d8f7797b705b7afde84ab,1,请问还有其他还可以帮到您的吗,2,0.405
2681,0648b2b7ca399b8aa3e60352a068c8a7,0,你好，请问我如果今天拍下笔记本电脑，要求一个星期发货，那么发票日期是显示拍下日期还是发货日期,0,0.0136
2684,0648b2b7ca399b8aa3e60352a068c8a7,1,出库日期，是发货的前一天这个样子发票是在等待打印的候开的,1,0.0339
2685,0648b2b7ca399b8aa3e60352a068c8a7,0,哦，这样啊，谢谢,2,0.9252
2686,0648b2b7ca399b8aa3e60352a068c8a7,1,请问还有其他还可以帮到您的吗,2,0.405
2687,064a389bfffe9d9365c844e5a5ba2461,0,我这个单需要退货，但是从昨天开始一直显示尚未收货,0,0.3216
2688,064a389bfffe9d9365c844e5a5ba2461,1,什么问题退货呢,1,0.0679
2689,064a389bfffe9d9365c844e5a5ba2461,0,其实已经是收货的了，买错了，已经和商家协商过,1,0.2789
2690,064a389bfffe9d9365c844e5a5ba2461,1,哦哦，您是手机客户端还是的电脑操作呢,1,0.9449
2691,064a389bfffe9d9365c844e5a5ba2461,0,电脑,1,0.5971
2692,064a389bfffe9d9365c844e5a5ba2461,1,申请售后链接您可以找到您对应的商品申请下哦,1,0.6734
2693,064a389bfffe9d9365c844e5a5ba2461,0,申请了就可以了是么,1,0.3567
2694,064a389bfffe9d9365c844e5a5ba2461,1,申请售后就可以了,1,0.3291
2695,064a389bfffe9d9365c844e5a5ba2461,0,谢谢,2,0.931
2696,064a389bfffe9d9365c844e5a5ba2461,1,您客气了,2,0.4646
2698,064fcd00b9bbddba7a48293e83859932,0,我想确认物流那边能通知到我吧,1,0.4745
2699,064fcd00b9bbddba7a48293e83859932,1,不客气的,2,0.2138
2700,064fcd00b9bbddba7a48293e83859932,0,还有我想确认一下，我另外有个订单退款了没,1,0.0558
2701,064fcd00b9bbddba7a48293e83859932,1,订单号呢，订单显示已经审核退款了，京东处理退款后期个工作日银行个工作日请您注意查收退款,1,0.0028
2702,064fcd00b9bbddba7a48293e83859932,0,好的，谢谢,2,0.9683
2703,064fcd00b9bbddba7a48293e83859932,1,不客气的,2,0.2138
2705,0652a298fe0786ccc210d65694123c94,1,请问有什么可以帮您,2,0.5504
2706,0652a298fe0786ccc210d65694123c94,0,你好我想问问装油烟机，预约师傅,1,0.8475
2707,0652a298fe0786ccc210d65694123c94,1,售后服务电话，需要预约一下厂家的呢,1,0.2495
2708,0652a298fe0786ccc210d65694123c94,0,不好在京东约吗,1,0.0196
2709,0652a298fe0786ccc210d65694123c94,1,这边需要厂家的呢，不好意思哈，给您添麻烦了呢,1,0.8204
2710,0652a298fe0786ccc210d65694123c94,0,没事，我去问问，谢谢没事了,2,0.8795
2711,0652a298fe0786ccc210d65694123c94,1,好的呢，谢谢您理解,2,0.8712
2712,0652a298fe0786ccc210d65694123c94,0,再见,2,0.2149
2713,0652a298fe0786ccc210d65694123c94,1,没有问题妹子就不打扰您哦，后期有问题再来咨询妹子哦,2,0.9263
2714,065a28677d3f31886cecf00dc89f29f8,0,现在没法配送吗,0,0.0158
2715,065a28677d3f31886cecf00dc89f29f8,1,小妹为您看看，您稍等哦,1,0.6254
2716,065a28677d3f31886cecf00dc89f29f8,0,人呢,0,0.592
2717,065a28677d3f31886cecf00dc89f29f8,1,亲爱哒，非常抱歉，让您久等了,2,0.7917
2718,065a28677d3f31886cecf00dc89f29f8,0,能送吗，几号能到，什么情况，干嘛呢你们,0,0.062
2719,065a28677d3f31886cecf00dc89f29f8,1,在线不是一对一服务的，回复慢了，请您稍等下哦，您的订单预计月日送达您手中,2,0.1404
2722,066d05ab346a3b84409f8d20040251a1,0,自营的这两天送货吗,1,0.2435
2723,066d05ab346a3b84409f8d20040251a1,1,亲爱的，妹子马上为您核实情况，请您稍等哈，正常配送,2,0.2916
2724,066d05ab346a3b84409f8d20040251a1,0,我还没下订单,1,0.287
2725,066d05ab346a3b84409f8d20040251a1,1,没事，您可以正常下单，可以正常配送到,1,0.7181
2726,066d05ab346a3b84409f8d20040251a1,0,你们的拼团不能添加别的产品了，我要买两个产品，一个有拼团活动，分成两个产品的话就要付两次运费,1,0.5779
2727,066d05ab346a3b84409f8d20040251a1,1,嗯嗯,1,0.6629
2728,066d05ab346a3b84409f8d20040251a1,0,没有别的办法吗,1,0.0772
2729,066d05ab346a3b84409f8d20040251a1,1,或是不参加拼团直接下单购买,1,0.2853
2730,066d05ab346a3b84409f8d20040251a1,0,两个到一块倒是能免运费,1,0.433
2731,066d05ab346a3b84409f8d20040251a1,1,是的嗯,1,0.5185
2732,066d05ab346a3b84409f8d20040251a1,0,就是参加拼团更便宜一,1,0.8666
2733,066d05ab346a3b84409f8d20040251a1,1,您可以考虑下拼团和运费那个可以先放弃下,1,0.6331
2734,066d05ab346a3b84409f8d20040251a1,0,我就问一下，能不能兼顾,1,0.1863
2735,066d05ab346a3b84409f8d20040251a1,1,暂是无法兼顾的呢,1,0.0941
2736,066d05ab346a3b84409f8d20040251a1,0,农村能送到哪里,1,0.11
2737,066d05ab346a3b84409f8d20040251a1,1,镇上，如距离镇很近，也是可以配送到,1,0.8894
2738,066d05ab346a3b84409f8d20040251a1,0,离得有远,1,0.6308
2739,066d05ab346a3b84409f8d20040251a1,1,可能需要您自取下每个方是不一样的哈建议您先下单，有的方是支持村一级配送的呢,1,0.9371
2740,066d05ab346a3b84409f8d20040251a1,0,这个从哪里能看到,1,0.3435
2741,066d05ab346a3b84409f8d20040251a1,1,每个方都是不一样的只有配送到后才可以得知无法给您预测的哦不过一般的情况都是只能配送到镇一级,2,0.5517
2742,066d05ab346a3b84409f8d20040251a1,0,谢谢,2,0.931
2745,066d05ab346a3b84409f8d20040251a1,1,您客气了，为您服务是小妹的荣幸呢，您好,2,0.7877
2746,066d05ab346a3b84409f8d20040251a1,0,那个拼团的送货速度有影响吗，和正常购买比,1,0.3145
2747,066d05ab346a3b84409f8d20040251a1,1,没有，正常配送,1,0.1228
2748,066fc759c7494e22317e3fbfc1c0f453,0,您好,1,0.5055
2750,066fc759c7494e22317e3fbfc1c0f453,0,全品类券对支付定金有用吗，如果定金用了全品类券，付全款还能用吗,1,0.4535
2751,066fc759c7494e22317e3fbfc1c0f453,1,可以使用,1,0.8764
2752,066fc759c7494e22317e3fbfc1c0f453,0,明白了,1,0.2531
2753,066fc759c7494e22317e3fbfc1c0f453,1,请问还有其他还可以帮到您的吗,2,0.405
2754,066fc759c7494e22317e3fbfc1c0f453,0,已好评，谢谢,2,0.979
2755,067de41c28bd5cbb90d178366cb46aa4,1,有什么问题我可以帮您处理或解决的呢,1,0.3449
2756,067de41c28bd5cbb90d178366cb46aa4,0,是这样，我前两天拍错成女款，现在能换成男款么,1,0.1995
2757,067de41c28bd5cbb90d178366cb46aa4,1,误购是吗，恩，是这样的，您想申请的话，需要确认收货，订单完成，申请路径，可通过我的京东客户服务返修退换货内申请也可直接击此链接，APP端可通过我的客户服务退换售后中申请;可通过个人中心客户服务退换售后进行申请哦，能够帮助到您是我的荣幸，请问还有什么需要帮助您的吗,1,0.234
2758,067de41c28bd5cbb90d178366cb46aa4,0,好的，对了，我申请了，你跟进下进度，待会我重新拍,1,0.829
2759,067de41c28bd5cbb90d178366cb46aa4,1,您的服务单，我会跟进的，感谢您对京东的支持，对客服的支持,2,0.9918
2760,06861ff3803514837965333ea8289df1,0,为什么不派件我收货方离配送不足m,0,0.0206
2761,06861ff3803514837965333ea8289df1,1,妹子给您联系催促下,1,0.3761
2762,06861ff3803514837965333ea8289df1,0,好的，谢谢,2,0.9683
2763,06861ff3803514837965333ea8289df1,1,亲亲已经联系催促,2,0.4431
2764,06861ff3803514837965333ea8289df1,0,暂没有，谢谢,2,0.3082
2765,06861ff3803514837965333ea8289df1,1,没有其他问题的话，妹子就和您说再见了哦，遇到像您这样宽容的客户真是对我莫大的支持呢还辛苦您击+给小妹评价下天凉了哦要多多注意保暖哦,2,0.9841
2766,068cb61af90522c4c36f48e26dd045fd,0,刚买了就降价，有保价吗,0,0.0397
2767,068cb61af90522c4c36f48e26dd045fd,1,马上核实情况，请您稍等哈，这个订单是吗，马上核实情况，请您稍等哈，是有优惠券降价吗,1,0.0247
2768,068cb61af90522c4c36f48e26dd045fd,0,我买的候会员价，现在怎么这么便宜,0,0.6589
2769,068cb61af90522c4c36f48e26dd045fd,1,价保是按照实际支付金额计算的,1,0.3726
2770,068cb61af90522c4c36f48e26dd045fd,0,行吧,0,0.4326
2771,068cb61af90522c4c36f48e26dd045fd,1,请问还有其他还可以帮到您的吗,2,0.405
2772,068e211def987ba8e5abbcf3568aeb38,0,我机油钱到账了，但是安装的那个费用没有退我,0,0.4507
2773,068e211def987ba8e5abbcf3568aeb38,0,好的，你直接帮我处理,1,0.6341
2774,068e211def987ba8e5abbcf3568aeb38,1,已经申请了,1,0.4618
2775,068e211def987ba8e5abbcf3568aeb38,0,好的，谢谢,2,0.9683
2776,068e211def987ba8e5abbcf3568aeb38,1,不客气,2,0.1942
2778,068ff8d0ea8498e10799594a2d285370,0,我内存卡订单怎么没法发,0,0.0125
2780,068ff8d0ea8498e10799594a2d285370,0,请问，之前买的内存卡下架了，还有没有办法修理,1,0.202
2781,068ff8d0ea8498e10799594a2d285370,1,为了更好的解决您的问题，需要核实一下商品的信息奥，请问是这个商品吗,1,0.0341
2782,068ff8d0ea8498e10799594a2d285370,0,是的呀,1,0.5427
2783,068ff8d0ea8498e10799594a2d285370,1,是什么问题申请售后的呢,1,0.0874
2784,068ff8d0ea8498e10799594a2d285370,0,有候显示不出来的,0,0.1382
2785,068ff8d0ea8498e10799594a2d285370,1,可以格式化之后在使用看看的哦,1,0.8296
2786,068ff8d0ea8498e10799594a2d285370,0,嗯嗯，我就想问这个都下架了，还怎么维修呀，不是写着年,0,0.1297
2787,068ff8d0ea8498e10799594a2d285370,1,亲是直接申请售后就是可以处理售后的呢，具体的话以审核结果为准的哦,2,0.4613
2788,068ff8d0ea8498e10799594a2d285370,0,好的,1,0.8565
2789,068ff8d0ea8498e10799594a2d285370,1,请问还有其他还可以帮到您的吗,2,0.405
2790,0692592ff0fde4d93a33eca0a068beab,0,您好,1,0.5055
2791,0692592ff0fde4d93a33eca0a068beab,1,请问有什么可以帮您,2,0.5504
2792,0692592ff0fde4d93a33eca0a068beab,0,我申请了一个售后，东芝退货,0,0.047
2793,0692592ff0fde4d93a33eca0a068beab,1,是的呢,1,0.5921
2794,0692592ff0fde4d93a33eca0a068beab,0,现在又不打算退了,0,0.0706
2795,0692592ff0fde4d93a33eca0a068beab,1,审核结果，还未取件您想取消服务单对吧,1,0.0368
2796,0692592ff0fde4d93a33eca0a068beab,0,我自己取消不了,0,0.0901
2797,0692592ff0fde4d93a33eca0a068beab,1,这边妹子帮您备注一下，您好，客户需要关闭服务单，不在退货，可以吗，您好,1,0.3802
2798,0692592ff0fde4d93a33eca0a068beab,0,不退了，决定了,0,0.1486
2799,0692592ff0fde4d93a33eca0a068beab,1,您好，客户需要关闭服务单，不在退货，请核实处理，谢谢，帮您备注了哈,2,0.6372
2800,0692592ff0fde4d93a33eca0a068beab,0,你们后台备注,1,0.2026
2801,0692592ff0fde4d93a33eca0a068beab,1,是的呢，已经备注了呢,1,0.7043
2802,0692592ff0fde4d93a33eca0a068beab,0,我需要操作什么,1,0.2301
2803,0692592ff0fde4d93a33eca0a068beab,1,您不需要的哈,2,0.8214
2804,0692592ff0fde4d93a33eca0a068beab,0,好的，后台我查看，没有更改，是系统还未显示么,1,0.0503
2805,0692592ff0fde4d93a33eca0a068beab,1,不是的哈，不显示呢,1,0.0987
2806,0692592ff0fde4d93a33eca0a068beab,0,只要不再麻烦快递人员过来就好,1,0.5735
2807,0692592ff0fde4d93a33eca0a068beab,1,妹子帮您备注后审核人员看到会关闭的呢,1,0.5839
2808,0692592ff0fde4d93a33eca0a068beab,0,好，谢谢,2,0.975
2809,0692592ff0fde4d93a33eca0a068beab,1,不客气哈，祝您新年快乐狗年旺旺旺,2,0.9563
2810,0692592ff0fde4d93a33eca0a068beab,0,没有了，春节快乐,2,0.881
2811,0692592ff0fde4d93a33eca0a068beab,1,谢谢您，没有问题妹子就不打扰您哦，后期有问题再来咨询妹子哦,2,0.9746
2812,0692711a69173af0feedc77deaf6e86f,0,订单,1,0.4008
2813,0692711a69173af0feedc77deaf6e86f,1,您方便简单描述下您的问题吗,1,0.2572
